公司代码,公司简称,公司全称,英文名称,注册地址,A股代码,A股简称,A股上市日期,A股总股本,A股流通股本,B股代码,B股 简 称,B股上市日期,B股总股本,B股流通股本,地      区,省    份,城     市,所属行业,公司网址
300069,金利华电,浙江金利华电气股份有限公司,"Zhejiang JinLiHua Electric Co.,LTD.",浙江省金华市金东经济开发区,300069,金利华电,2010-04-21,"117,000,000","84,233,100",,,,0,0,华东,浙江,金华市,C 制造业,www.jlhdq.com
300070,碧水源,北京碧水源科技股份有限公司,"BEIJING ORIGINWATER TECHNOLOGY CO.,LTD.",北京市海淀区生命科学园路23-2号碧水源大厦,300070,碧水源,2010-04-21,"3,123,401,929","1,644,519,382",,,,0,0,华北,北京,北京市,N 公共环保,www.originwater.com
300071,华谊嘉信,北京华谊嘉信整合营销顾问集团股份有限公司,"Spearhead Integrated Marketing Communication Co., LTD.",北京市石景山区实兴大街30号院8号楼512,300071,华谊嘉信,2010-04-21,"685,294,641","429,256,287",,,,0,0,华北,北京,北京市,L 商务服务,www.spearhead.com.cn
300072,三聚环保,北京三聚环保新材料股份有限公司,"Beijing Sanju Environmental Protection & New Materials Co.,Ltd.",北京市海淀区人大北路33号1号楼大行基业大厦9层,300072,三聚环保,2010-04-27,"1,192,953,043","893,017,236",,,,0,0,华北,北京,北京市,C 制造业,www.sanju.cn
300073,当升科技,北京当升材料科技股份有限公司,"Beijing Easpring Material Technology Co.,Ltd.",北京市丰台区南四环西路188号总部基地18区21号,300073,当升科技,2010-04-27,"183,034,020","158,992,393",,,,0,0,华北,北京,北京市,C 制造业,www.easpring.com.cn
300074,华平股份,华平信息技术股份有限公司,"AVCON Information Technology Co., Ltd.",上海市杨浦区国权北路1688号湾谷科技园A6栋,300074,华平股份,2010-04-27,"528,000,000","434,516,267",,,,0,0,华东,上海,上海市,I 信息技术,www.avcon.com.cn
300075,数字政通,北京数字政通科技股份有限公司,"Beijing eGOVA Co., Ltd",北京市海淀区西直门北大街32号枫蓝国际中心A座楼18层1805室,300075,数字政通,2010-04-27,"392,904,510","267,943,023",,,,0,0,华北,北京,北京市,I 信息技术,www.egova.com.cn
300076,GQY视讯,宁波GQY视讯股份有限公司,"Ningbo GQY Video & Telecom Joint-Stock Co., Ltd.",浙江省宁波市海曙区环城西路南段88号,300076,GQY视讯,2010-04-30,"424,000,000","367,917,300",,,,0,0,华东,浙江,宁波市,C 制造业,www.gqy.com.cn
300077,国民技术,国民技术股份有限公司,Nationz Technologies,广东省深圳市南山区高新技术产业园区深圳软件园3栋301、302,300077,国民技术,2010-04-30,"563,640,000","537,949,250",,,,0,0,华南,广东,深圳市,C 制造业,www.nationz.com.cn
300078,思创医惠,思创医惠科技股份有限公司,"HANGZHOU CENTURY CO.,LTD.",浙江省杭州市莫干山路1418-25号(上城科技经济园),300078,思创医惠,2010-04-30,"418,750,000","253,460,905",,,,0,0,华东,浙江,杭州市,C 制造业,www.century-cn.com
300079,数码视讯,北京数码视讯科技股份有限公司,"Sumavision Technologies Co.,Ltd",北京市海淀区上地信息产业基地开拓路15号1幢,300079,数码视讯,2010-04-30,"1,377,793,862","1,207,777,437",,,,0,0,华北,北京,北京市,C 制造业,www.sumavision.com
300080,易成新能,河南易成新能源股份有限公司,"Henan Yicheng New Energy Co., Ltd",河南省开封市精细化工产业园区,300080,易成新能,2010-06-25,"502,804,021","502,017,465",,,,0,0,华中,河南,开封市,C 制造业,www.ycne.com.cn
300081,恒信移动,恒信移动商务股份有限公司,"Hengxin Mobile Business Co.,Ltd.",河北省石家庄市开发区天山大街副69号,300081,恒信移动,2010-05-20,"335,000,000","229,172,165",,,,0,0,华北,河北,石家庄市,F 批发零售,www.hxgro.com
300082,奥克股份,辽宁奥克化学股份有限公司,"Liao Ning Oxiranchem, Inc.",辽宁省辽阳市宏伟区万和七路38号,300082,奥克股份,2010-05-20,"673,920,000","673,861,500",,,,0,0,东北,辽宁,辽阳市,C 制造业,www.oxiranchem.com
300083,劲胜精密,东莞劲胜精密组件股份有限公司,"JANUS(Dongguan) Precision Components Co.,Ltd.",广东省东莞市长安镇上角村,300083,劲胜精密,2010-05-20,"1,423,578,568","910,546,136",,,,0,0,华南,广东,东莞市,C 制造业,www.januscn.com
300084,海默科技,兰州海默科技股份有限公司,"Lanzhou Haimo Technologies Co.,Ltd.",甘肃省兰州市城关区张苏滩593号,300084,海默科技,2010-05-20,"324,765,738","249,476,718",,,,0,0,西北,甘肃,兰州市,B 采矿业,www.haimo.com.cn
300085,银之杰,深圳市银之杰科技股份有限公司,"SHENZHEN INFOGEM TECHNOLOGIES CO., LTD.",广东省深圳市福田区车公庙天安数码城天祥大厦AB座5B2,300085,银之杰,2010-05-26,"683,545,769","326,364,397",,,,0,0,华南,广东,深圳市,I 信息技术,www.yinzhijie.com
300086,康芝药业,海南康芝药业股份有限公司,"HAINAN HONZ PHARMACEUTICAL CO., LTD.",海南省海口国家高新技术产业开发区药谷工业园药谷三路6号,300086,康芝药业,2010-05-26,"450,000,000","437,917,507",,,,0,0,华南,海南,海口市,C 制造业,www.honz.com.cn
300087,荃银高科,安徽荃银高科种业股份有限公司,"Winall Hi-tech Seed Co.,Ltd.",安徽省合肥市高新区创新大道98号,300087,荃银高科,2010-05-26,"319,820,000","264,860,732",,,,0,0,华东,安徽,合肥市,A 农林牧渔,www.winallseed.com
300088,长信科技,芜湖长信科技股份有限公司,"Wuhu Token Science Co.,LTD.",安徽省芜湖市经济技术开发区汽经二路以东,300088,长信科技,2010-05-26,"1,149,439,907","1,099,347,876",,,,0,0,华东,安徽,芜湖市,C 制造业,www.token-ito.com
300089,文化长城,广东文化长城集团股份有限公司,The Great Wall Of Culture Group Holding Co.，Ltd. Guangdong,广东省潮州市枫溪区蔡陇大道,300089,文化长城,2010-06-25,"375,000,000","216,296,375",,,,0,0,华南,广东,潮州市,C 制造业,www.thegreatwall-china.com
300090,盛运环保,安徽盛运环保（集团）股份有限公司,"Anhui Shengyun Environment-Protection group Co., Ltd",安徽省桐城市区快活岭,300090,盛运环保,2010-06-25,"1,319,952,922","786,756,010",,,,0,0,华东,安徽,安庆市,C 制造业,www.300090.com.cn
300091,金通灵,江苏金通灵流体机械科技股份有限公司,"JiangSu Jin Tong Ling Fluid Machinery Technology Co., Ltd.",江苏省南通市钟秀中路135号,300091,金通灵,2010-06-25,"522,500,000","361,139,403",,,,0,0,华东,江苏,南通市,C 制造业,www.jtlfans.com
300092,科新机电,四川科新机电股份有限公司,"Sichuan Kexin Mechanical and Electrical Equipment Co.,Ltd.",四川省什邡市马祖镇,300092,科新机电,2010-07-08,"227,500,000","160,541,251",,,,0,0,西南,四川,德阳市,C 制造业,www.sckxjd.com
300093,金刚玻璃,广东金刚玻璃科技股份有限公司,GUANGDONG GOLDEN GLASS TECHNOLOGIES LIMITED,广东省汕头市大学路叠金工业区,300093,金刚玻璃,2010-07-08,"216,000,000","215,234,625",,,,0,0,华南,广东,汕头市,C 制造业,www.golden-glass.cn
300094,国联水产,湛江国联水产开发股份有限公司,"ZHANJIANG GUOLIAN AQUATIC PRODUCTS CO., LTD",广东省湛江开发区平乐工业区永平南路,300094,国联水产,2010-07-08,"778,375,620","745,670,952",,,,0,0,华南,广东,湛江市,A 农林牧渔,www.gl-fish.com
300095,华伍股份,江西华伍制动器股份有限公司,"Jiangxi Huawu Brake Co., Ltd.",江西省丰城市高新技术产业园区火炬大道26号,300095,华伍股份,2010-07-28,"376,079,254","232,185,600",,,,0,0,华东,江西,宜春市,C 制造业,www.hua-wu.com
300096,易联众,易联众信息技术股份有限公司,"YLZ Information Technology CO.,Ltd",福建省厦门市软件园二期观日路18号502室,300096,易联众,2010-07-28,"430,000,000","373,130,638",,,,0,0,华东,福建,厦门市,I 信息技术,www.ylzinfo.com
300097,智云股份,大连智云自动化装备股份有限公司,"Dalian Zhiyun Automation Co., Ltd",辽宁省大连市甘井子区营日路32号-1,300097,智云股份,2010-07-28,"149,416,575","82,923,273",,,,0,0,东北,辽宁,大连市,C 制造业,www.zhiyun-cn.com
300098,高新兴,高新兴科技集团股份有限公司,"Gosuncn technology group Co., Ltd.",广东省广州市萝岗区科学城开创大道2819号六楼,300098,高新兴,2010-07-28,"1,074,764,571","479,824,336",,,,0,0,华南,广东,广州市,I 信息技术,www.gosuncn.com
300099,尤洛卡,尤洛卡矿业安全工程股份有限公司," Uroica Mining Saftety Engineering Co.,LTD",山东省泰安市高新区凤祥路以西规划支路以北,300099,尤洛卡,2010-08-06,"536,498,632","357,341,987",,,,0,0,华东,山东,泰安市,C 制造业,www.uroica.com.cn
300100,双林股份,宁波双林汽车部件股份有限公司,"Ningbo Shuanglin Auto Parts Co.,LTD",浙江省宁波市宁海县西店镇潢溪口,300100,双林股份,2010-08-06,"395,775,246","268,848,000",,,,0,0,华东,浙江,宁波市,C 制造业,www.shuanglin.cn
300101,振芯科技,成都振芯科技股份有限公司,"Chengdu CORPRO Technology Co., Ltd.",四川省成都高新区高朋大道1号,300101,振芯科技,2010-08-06,"556,000,000","440,403,980",,,,0,0,西南,四川,成都市,C 制造业,www.corpro.cn
300102,乾照光电,厦门乾照光电股份有限公司,"Xiamen Changelight Co.,LTD.",福建省厦门火炬高新区（翔安）产业区翔天路259-269号,300102,乾照光电,2010-08-12,"704,553,311","590,000,000",,,,0,0,华东,福建,厦门市,C 制造业,www.changelight.com.cn
300103,达刚路机,西安达刚路面机械股份有限公司,"XI""AN DAGANG ROAD MACHINERY CO.,LTD.",陕西省西安市高新技术产业开发区科技三路60号,300103,达刚路机,2010-08-12,"211,734,000","84,389,010",,,,0,0,西北,陕西,西安市,C 制造业,www.sxdagang.com
300104,乐视网,乐视网信息技术（北京）股份有限公司,"LESHI INTERNET INFORMATION & TECHNOLOGY CORP,. BEIJING",北京市海淀区学院南路68号19号楼六层6184号房间,300104,乐视网,2010-08-12,"1,873,846,821","1,249,566,570",,,,0,0,华北,北京,北京市,I 信息技术,www.letv.com
300105,龙源技术,烟台龙源电力技术股份有限公司,"YANTAI LONGYUAN POWER TECHNOLOGY CO., LTD.",山东省烟台市经济技术开发区衡山路9号,300105,龙源技术,2010-08-20,"513,216,000","513,216,000",,,,0,0,华东,山东,烟台市,C 制造业,www.lypower.com
300106,西部牧业,新疆西部牧业股份有限公司,"Xinjiang Western Animal Husbandry Co.,Ltd",新疆维吾尔自治区石河子市西四路5-2号,300106,西部牧业,2010-08-20,"211,332,310","210,298,796",,,,0,0,西北,新疆,石河子市,A 农林牧渔,www.xjxbmy.com
300107,建新股份,河北建新化工股份有限公司,"Hebei Jianxin Chemical Co., Ltd.",河北省沧州市临港化工园区（中捷农场）,300107,建新股份,2010-08-20,"543,788,298","336,687,885",,,,0,0,华北,河北,沧州市,C 制造业,www.jianxinchemical.com
300108,双龙股份,通化双龙化工股份有限公司,"TONGHUA SHUANGLONG CHEMICAL CO., LTD.",吉林省通化市二道江区铁厂镇,300108,双龙股份,2010-08-25,"636,014,674","330,736,223",,,,0,0,东北,吉林,通化市,C 制造业,www.thslhg.com
300109,新开源,博爱新开源制药股份有限公司,Boai NKY Pharmaceuticals Ltd.,河南省焦作市博爱县文化路（东段）1888号,300109,新开源,2010-08-25,"170,482,422","83,905,940",,,,0,0,华中,河南,焦作市,C 制造业,www.china-pvp.com
300110,华仁药业,华仁药业股份有限公司,"Huaren Pharmaceutial CO.,LTD",山东省青岛市高科技工业园株洲路187号,300110,华仁药业,2010-08-25,"657,403,425","653,628,660",,,,0,0,华东,山东,青岛市,C 制造业,www.qdhuaren.com
300111,向日葵,浙江向日葵光能科技股份有限公司,"Zhejiang Sunflower Light Energy Science&Technology Co., ltd",浙江省绍兴袍江工业区三江路,300111,向日葵,2010-08-27,"1,119,800,000","1,116,355,116",,,,0,0,华东,浙江,绍兴市,C 制造业,www.sunowe.com.cn
300112,万讯自控,深圳万讯自控股份有限公司,"Shenzhen Maxonic Automation Control Co.,Ltd",广东省深圳市南山区高新技术产业园北区三号路万讯自控大楼1-6层,300112,万讯自控,2010-08-27,"266,588,197","152,413,375",,,,0,0,华南,广东,深圳市,C 制造业,www.maxonic.com.cn
300113,顺网科技,杭州顺网科技股份有限公司,"Hangzhou Shunwang Technology Co.,Ltd",浙江省杭州市西湖区文一西路75号3号楼,300113,顺网科技,2010-08-27,"685,808,121","408,031,680",,,,0,0,华东,浙江,杭州市,I 信息技术,www.shunwang.com
300114,中航电测,中航电测仪器股份有限公司,"Zhonghang Electronic Measuring Instruments Co.,Ltd",陕西省汉中市经济开发区北区鑫源路,300114,中航电测,2010-08-27,"393,840,333","304,193,588",,,,0,0,西北,陕西,汉中市,C 制造业,www.zemic.com.cn
300115,长盈精密,深圳市长盈精密技术股份有限公司,"Shenzhen Everwin Precision Technology Co.,Ltd",广东省深圳市宝安区福永镇桥头富桥工业3区3号厂,300115,长盈精密,2010-09-02,"902,127,963","898,598,133",,,,0,0,华南,广东,深圳市,C 制造业,www.ewpt.cn
300116,坚瑞消防,陕西坚瑞消防股份有限公司,"Shaanxi J&R Fire Protection CO., LTD",陕西省西安市高新区科技二路65号6幢10701房,300116,坚瑞消防,2010-09-02,"500,237,610","307,649,466",,,,0,0,西北,陕西,西安市,C 制造业,www.xajr.com
300117,嘉寓股份,北京嘉寓门窗幕墙股份有限公司,"Beijing JIAYU Door,Window and Curtain Wall Joint-Stock Co.,Ltd.",北京市顺义区牛栏山镇牛富路1号,300117,嘉寓股份,2010-09-02,"716,760,000","715,660,000",,,,0,0,华北,北京,北京市,E 建筑业,www.jiayu.com.cn
300118,东方日升,东方日升新能源股份有限公司,"RISEN ENERNY CO.,LTD",浙江省宁波市宁海县梅林街道塔山工业园区,300118,东方日升,2010-09-02,"674,593,924","442,889,879",,,,0,0,华东,浙江,宁波市,C 制造业,www.risenenergy.com
300119,瑞普生物,天津瑞普生物技术股份有限公司,"Tianjin Ringpu Bio-Technology Co.,Ltd.",天津市天津空港经济区东九道1号,300119,瑞普生物,2010-09-17,"389,146,281","203,036,574",,,,0,0,华北,天津,天津市,C 制造业,www.ringpu.com
300120,经纬电材,天津经纬电材股份有限公司,"Tianjin Jingwei Electric Wire Co.,Ltd",天津市津南经济开发区（双港）旺港路12号,300120,经纬电材,2010-09-17,"204,816,059","164,747,785",,,,0,0,华北,天津,天津市,C 制造业,www.jwdc.cn
300121,阳谷华泰,山东阳谷华泰化工股份有限公司,"Shandong Yanggu Huatai Chemical Co., Ltd.",山东省阳谷县清河西路217号,300121,阳谷华泰,2010-09-17,"289,220,000","269,459,152",,,,0,0,华东,山东,聊城市,C 制造业,www.yghuatai.com
300122,智飞生物,重庆智飞生物制品股份有限公司,"Chongqing Zhifei Biological Products Co.,Ltd.",重庆市江北区金源路7号25-1至25-8,300122,智飞生物,2010-09-28,"1,600,000,000","863,432,500",,,,0,0,西南,重庆,重庆市,C 制造业,www.zhifeishengwu.com
300123,太阳鸟,太阳鸟游艇股份有限公司,Sunbird Yacht Company Limited,湖南省沅江市游艇工业园,300123,太阳鸟,2010-09-28,"285,166,318","274,080,718",,,,0,0,华中,湖南,益阳市,C 制造业,www.cnsunbird.com
300124,汇川技术,深圳市汇川技术股份有限公司,"Shenzhen Inovance Technology Co., Ltd",广东省深圳市龙华新区观澜街道高新技术产业园汇川技术总部基地,300124,汇川技术,2010-09-28,"1,604,038,910","1,263,352,700",,,,0,0,华南,广东,深圳市,C 制造业,www.inovance.cn
300125,易世达,大连易世达新能源发展股份有限公司,"Dalian East New Energy Development CO.,Ltd.",辽宁省大连高新园区火炬路32号B座18-20层,300125,易世达,2010-10-13,"118,000,000","88,050,938",,,,0,0,东北,辽宁,大连市,M 科研服务,www.dleast.cc
300126,锐奇股份,锐奇控股股份有限公司,"KEN HOLDING CO.,LTD.",上海市松江区新桥镇新茸路5号,300126,锐奇股份,2010-10-13,"306,338,400","210,472,979",,,,0,0,华东,上海,上海市,C 制造业,www.kenpowertools.com
300127,银河磁体,成都银河磁体股份有限公司,"Chengdu Galaxy Magnets Co.,Ltd.",四川省成都市高新技术开发区西区百草路6号,300127,银河磁体,2010-10-13,"323,146,360","221,039,890",,,,0,0,西南,四川,成都市,C 制造业,www.galaxymagnets.com
300128,锦富新材,苏州锦富新材料股份有限公司,"SuZhou JinFu New Material Co.,Ltd",江苏省苏州工业园区江浦路39号,300128,锦富新材,2010-10-13,"479,437,057","312,637,831",,,,0,0,华东,江苏,苏州市,C 制造业,www.jin-fu.cn
300129,泰胜风能,上海泰胜风能装备股份有限公司,"Shanghai Taisheng Wind Power Equipment Co., Ltd.",上海市金山区卫清东路1988号,300129,泰胜风能,2010-10-19,"731,514,686","450,183,316",,,,0,0,华东,上海,上海市,C 制造业,www.shtsp.com
300130,新国都,深圳市新国都技术股份有限公司,"Shenzhen Xinguodu Technology Co.,Ltd.",广东省深圳市福田区深南路车公庙工业区泰然劲松大厦17A,300130,新国都,2010-10-19,"235,262,560","153,129,639",,,,0,0,华南,广东,深圳市,C 制造业,www.xinguodu.com
300131,英唐智控,深圳市英唐智能控制股份有限公司,"ShenZhen Yitoa Intelligent Control Co.,Ltd.",广东省深圳市南山区高新技术产业园科技南五路英唐大厦五楼,300131,英唐智控,2010-10-19,"1,069,526,426","627,814,728",,,,0,0,华南,广东,深圳市,F 批发零售,www.yitoa.com
300132,青松股份,福建青松股份有限公司,"Fujian Green Pine Co.,LTD",福建省建阳市回瑶工业园区,300132,青松股份,2010-10-26,"385,920,000","275,503,223",,,,0,0,华东,福建,南平市,C 制造业,www.greenpine.cc
300133,华策影视,浙江华策影视股份有限公司,"Zhejiang Huace Film & TV Co.,Ltd.",浙江省杭州市文二西路683号西溪创意产业园C-C座,300133,华策影视,2010-10-26,"1,746,625,521","1,152,893,453",,,,0,0,华东,浙江,杭州市,R 文化传播,www.huacemedia.com
300134,大富科技,深圳市大富科技股份有限公司,"Shenzhen Tatfook Technology Co.,Ltd",广东省深圳市宝安区沙井街道蚝乡路沙井工业公司第三工业区A1、A2、A3的101、A4的第一、二、三层,300134,大富科技,2010-10-26,"652,800,000","597,718,500",,,,0,0,华南,广东,深圳市,C 制造业,www.tatfook.com
300135,宝利国际,江苏宝利国际投资股份有限公司,"Jiangsu Baoli International Investment Co., Ltd.",江苏省江阴市云亭镇工业园区,300135,宝利国际,2010-10-26,"921,600,000","712,384,928",,,,0,0,华东,江苏,无锡市,C 制造业,www.baolijt.cn
300136,信维通信,深圳市信维通信股份有限公司,"Shenzhen Sunway Communication Co., Ltd.",广东省深圳市宝安区沙井街道西环路1013号A，B栋,300136,信维通信,2010-11-05,"957,403,038","662,755,156",,,,0,0,华南,广东,深圳市,C 制造业,www.sz-sunway.com.cn
300137,先河环保,河北先河环保科技股份有限公司,"Hebei Sailhero Environmental Protection High-tech Co., ltd.",河北省石家庄市高新技术开发区湘江道251号,300137,先河环保,2010-11-05,"344,395,344","290,577,466",,,,0,0,华北,河北,石家庄市,C 制造业,www.sailhero.com.cn
300138,晨光生物,晨光生物科技集团股份有限公司,"CHENGUANG BIOTECH GROUP CO.,LTD",河北省曲周县城晨光路1号,300138,晨光生物,2010-11-05,"262,110,302","169,846,514",,,,0,0,华北,河北,邯郸市,C 制造业,www.cn-cg.com
300139,晓程科技,北京晓程科技股份有限公司,"Beijing XIAOCHENG Technology Stock Co., Ltd",北京市海淀区西三环北路87号国际财经中心D座503,300139,晓程科技,2010-11-12,"274,000,000","212,161,048",,,,0,0,华北,北京,北京市,C 制造业,www.xiaocheng.com
300140,启源装备,西安启源机电装备股份有限公司,"XI"" AN QIYUAN MECHANICAL AND ELECTRICAL EQUIPMENT CO.,LTD.",陕西省西安市经济技术开发区凤城十二路98号,300140,启源装备,2010-11-12,"244,000,000","241,965,160",,,,0,0,西北,陕西,西安市,C 制造业,www.sdricom.com
300141,和顺电气,苏州工业园区和顺电气股份有限公司,"Suzhou Industrial Park Heshun Electric Co.,Ltd.",江苏省苏州工业园区和顺路8号,300141,和顺电气,2010-11-12,"166,966,400","108,526,749",,,,0,0,华东,江苏,苏州市,C 制造业,www.cnheshun.com
300142,沃森生物,云南沃森生物技术股份有限公司,"Walvax Biotechnology Co.,Ltd.",云南省昆明市高新开发区北区云南大学科技园2期A3幢4楼,300142,沃森生物,2010-11-12,"1,404,000,000","1,066,760,995",,,,0,0,西南,云南,昆明市,C 制造业,www.walvax.com
300143,星河生物,广东星河生物科技股份有限公司,"Starway Bio-technology Co., Ltd",广东省东莞市塘厦镇蛟坪大道83号,300143,星河生物,2010-12-09,"233,938,544","106,030,479",,,,0,0,华南,广东,东莞市,A 农林牧渔,www.starway.com.cn
300144,宋城演艺,宋城演艺发展股份有限公司,SONGCHENG PERFORMANCE DEVELOPMENT CO .，LTD.,浙江省杭州市之江路148号,300144,宋城演艺,2010-12-09,"1,452,613,577","1,094,786,617",,,,0,0,华东,浙江,杭州市,R 文化传播,www.chinascgf.com
300145,中金环境,南方中金环境股份有限公司,"Nanfang Zhongjin Environment Co., Ltd.",浙江省杭州市余杭区仁和街道仁河大道46号,300145,中金环境,2010-12-09,"667,860,408","359,879,726",,,,0,0,华东,浙江,杭州市,C 制造业,www.nanfang-pump.com
300146,汤臣倍健,汤臣倍健股份有限公司,"BY-HEALTH CO.,LTD",广东省珠海市金湾区三灶科技工业园星汉路19号,300146,汤臣倍健,2010-12-15,"1,456,021,880","860,141,002",,,,0,0,华南,广东,珠海市,C 制造业,www.by-health.com.cn
300147,香雪制药,广州市香雪制药股份有限公司,"Xiangxue Pharmaceutical Co., Ltd.",广东省广州市萝岗区广州经济技术开发区科学城金峰园路2号,300147,香雪制药,2010-12-15,"661,476,335","659,909,555",,,,0,0,华南,广东,广州市,C 制造业,www.xphcn.com
300148,天舟文化,天舟文化股份有限公司,"TANGEL PUBLISHING CO.,LTD",湖南省长沙县星沙镇茶叶大市场办公楼502、602号,300148,天舟文化,2010-12-15,"506,821,810","435,846,949",,,,0,0,华中,湖南,长沙市,R 文化传播,www.t-angel.com
300149,量子高科,量子高科（中国）生物股份有限公司,"Quanturn Hi-Tech （China）Biological Co.,Ltd",广东省江门市高新区高新西路133号,300149,量子高科,2010-12-22,"422,100,000","405,145,879",,,,0,0,华南,广东,江门市,C 制造业,www.qht.cc
300150,世纪瑞尔,北京世纪瑞尔技术股份有限公司,"Beijing Century Real Technology Co.,Ltd.",北京市海淀区创业路8号3号楼6层3-9,300150,世纪瑞尔,2010-12-22,"540,000,000","327,061,117",,,,0,0,华北,北京,北京市,I 信息技术,www.c-real.com.cn
300151,昌红科技,深圳市昌红科技股份有限公司,"SHENZHEN CHANGHONG TECHNOLOGY Co.,Ltd.",广东省深圳市坪山新区坪山锦龙大道西侧,300151,昌红科技,2010-12-22,"502,500,000","284,412,805",,,,0,0,华南,广东,深圳市,C 制造业,www.sz-changhong.com
300152,科融环境,徐州科融环境资源股份有限公司,"Xuzhou Kerong Environmental Resources Co.,Ltd.",江苏省徐州市经济开发区杨山路12号,300152,科融环境,2010-12-29,"712,800,000","712,796,700",,,,0,0,华东,江苏,徐州市,C 制造业,www.kre.cn
300153,科泰电源,上海科泰电源股份有限公司,"SHANGHAI COOLTECH POWER CO.,LTD.",上海市青浦区张江高新区青浦园天辰路1633号,300153,科泰电源,2010-12-29,"320,000,000","319,516,175",,,,0,0,华东,上海,上海市,C 制造业,www.cooltechsh.com
300154,瑞凌股份,深圳市瑞凌实业股份有限公司,"SHENZHEN RILAND INDUSTRY CO., LTD",广东省深圳市光明新区观光路3009号招商局科技园A3栋C单元207,300154,瑞凌股份,2010-12-29,"447,000,000","313,824,900",,,,0,0,华南,广东,深圳市,C 制造业,www.riland.com.cn
300155,安居宝,广东安居宝数码科技股份有限公司,"GUANGDONG ANJUBAO DIGITAL TECHNOLOGY CO.,LTD.",广东省广州开发区科学城起云路6号,300155,安居宝,2011-01-07,"543,370,602","267,678,717",,,,0,0,华南,广东,广州市,C 制造业,www.anjubao.com
300156,神雾环保,神雾环保技术股份有限公司,"Shenwu Environmental Technology CO.,LTD",北京市朝阳区将台路5号院15号楼C座6层,300156,神雾环保,2011-01-07,"1,010,024,415","654,662,490",,,,0,0,华北,北京,北京市,C 制造业,www.swet.net.cn
300157,恒泰艾普,恒泰艾普石油天然气技术服务股份有限公司,"LandOcean Energy Services Co., LTD.",北京市海淀区丰秀中路3号院4号楼401室,300157,恒泰艾普,2011-01-07,"712,772,080","577,173,852",,,,0,0,华北,北京,北京市,B 采矿业,www.ldocean.com.cn
300158,振东制药,山西振东制药股份有限公司,"Shanxi Zhendong Pharmaceutical Co.,Ltd",山西省长治县光明南路振东科技园,300158,振东制药,2011-01-07,"296,940,000","286,132,637",,,,0,0,华北,山西,长治市,C 制造业,www.zdjt.com
300159,新研股份,新疆机械研究院股份有限公司,"Xinjiang Machinery Research Institute Co.,Ltd",新疆维吾尔自治区乌鲁木齐经济技术开发区融合南路661号,300159,新研股份,2011-01-07,"1,490,360,202","565,457,846",,,,0,0,西北,新疆,乌鲁木齐市,C 制造业,www.xjjxy.com.cn
300160,秀强股份,江苏秀强玻璃工艺股份有限公司,"JIANGSU XIUQIANG GLASSWORK CO., LTD.",江苏省宿迁市宿豫区江山大道28号,300160,秀强股份,2011-01-13,"597,760,000","592,381,114",,,,0,0,华东,江苏,宿迁市,C 制造业,www.jsxq.com
