公司代码,公司简称,公司全称,英文名称,注册地址,A股代码,A股简称,A股上市日期,A股总股本,A股流通股本,B股代码,B股 简 称,B股上市日期,B股总股本,B股流通股本,地      区,省    份,城     市,所属行业,公司网址
000889,茂业通信,茂业通信网络股份有限公司,"Maoye Communication and Network Co.,Ltd",河北省秦皇岛市河北大街146号金原国际商务大厦,000889,茂业通信,1997-12-18,"621,826,786","445,264,280",,,,0,0,华北,河北,秦皇岛市,F 批发零售,www.hlsc.com.cn
000890,法 尔 胜,江苏法尔胜股份有限公司,"JIANGSU FASTEN CO.,LTD",江苏省江阴市澄江中路165号,000890,法 尔 胜,1999-01-19,"379,641,600","379,555,910",,,,0,0,华东,江苏,无锡市,C 制造业,www.fasten.com.cn
000892,星美联合,星美联合股份有限公司,STELLAR MEGAUNION CORPORATION,重庆市涪陵区人民东路50号,000892,星美联合,1999-01-15,"413,876,880","306,938,440",,,,0,0,西南,重庆,重庆市,I 信息技术,www.chinacfc.com
000893,东凌国际,广州东凌国际投资股份有限公司,"DONLINKS INTERNATIONAL INVESTMENT CO., LTD.",广东省广州市南沙区万顷沙镇红安路3号,000893,东凌国际,1998-12-24,"756,903,272","400,734,450",,,,0,0,华南,广东,广州市,C 制造业,www.dongling.cn
000895,双汇发展,河南双汇投资发展股份有限公司,"HENAN SHUANGHUI INVESTMENT & DEVELOPMENT CO.,LTD",河南省漯河市双汇路1号,000895,双汇发展,1998-12-10,"3,300,867,672","1,817,450,010",,,,0,0,华中,河南,漯河市,C 制造业,www.shuanghui.net
000897,津滨发展,天津津滨发展股份有限公司,"TIANJIN JINBIN DEVELOPMENT CO., LTD",天津市经济技术开发区黄海路98号津滨杰座2区B座一门501室,000897,津滨发展,1999-04-22,"1,617,272,234","1,617,200,859",,,,0,0,华北,天津,天津市,K 房地产,www.jbdc.com.cn
000898,鞍钢股份,鞍钢股份有限公司,"ANGANG STEEL CO.,LTD",辽宁省鞍山市铁西区鞍钢厂区,000898,鞍钢股份,1997-12-25,"6,149,007,847","6,148,976,360",,,,0,0,东北,辽宁,鞍山市,C 制造业,www.ansteel.com.cn
000899,赣能股份,江西赣能股份有限公司,"JIANGXI GANNENG CO.,LTD",江西省南昌市高新技术开发区火炬大街199号,000899,赣能股份,1997-11-26,"975,677,760","555,181,703",,,,0,0,华东,江西,南昌市,D 水电煤气,www.000899.com
000900,现代投资,现代投资股份有限公司,"XIANDAI INVESTMENT CO., LTD",湖南省长沙市天心区芙蓉南路二段128号现代广场,000900,现代投资,1999-01-28,"1,011,885,556","1,010,787,844",,,,0,0,华中,湖南,长沙市,G 运输仓储,www.xdtz.net
000901,航天科技,航天科技控股集团股份有限公司,"AEROSPACE HI-TECH HOLDING GROUP CO., LTD.",黑龙江省哈尔滨市平房区哈平西路45号,000901,航天科技,1999-04-01,"323,624,221","323,624,221",,,,0,0,东北,黑龙江,哈尔滨市,C 制造业,
000902,新洋丰,湖北新洋丰肥业股份有限公司,"HUBEI XINYANGFENG FERTILIZER Co., Ltd.",湖北省荆门市月亮湖北路附7号,000902,新洋丰,1999-04-08,"1,318,449,290","613,381,220",,,,0,0,华中,湖北,荆门市,C 制造业,www.newyf.com
000903,云内动力,昆明云内动力股份有限公司,"KUNMING YUNNEI POWER CO., LTD.",云南省昆明市经济技术开发区经景路66号,000903,云内动力,1999-04-15,"799,013,968","790,601,269",,,,0,0,西南,云南,昆明市,C 制造业,www.yunneidongli.com
000905,厦门港务,厦门港务发展股份有限公司,"XIAMEN PORT DEVELOPMENT CO., LTD.",福建省厦门市东港北路31号港务大厦20楼、21楼,000905,厦门港务,1999-04-29,"531,000,000","531,000,000",,,,0,0,华东,福建,厦门市,G 运输仓储,www.xmgw.com.cn
000906,物产中拓,物产中拓股份有限公司,"ZHEJIANG MATERIALS  DEVELOPMENT CO.,LTD.",湖南省长沙市芙蓉区五一大道235号湘域中央1栋401号,000906,物产中拓,1999-07-07,"392,932,669","330,605,802",,,,0,0,华中,湖南,长沙市,F 批发零售,www.zmd.com.cn
000908,景峰医药,湖南景峰医药股份有限公司,"Hunan Jingfeng Pharmaceutical Co.,Ltd.",湖南省岳阳市平江县天岳经济开发区天岳大道,000908,景峰医药,1999-02-03,"879,774,351","480,273,073",,,,0,0,华中,湖南,岳阳市,C 制造业,www.hntane.com
000909,数源科技,数源科技股份有限公司,"SOYEA TECHNOLOGY CO., LTD",浙江省杭州西湖区教工路一号,000909,数源科技,1999-05-07,"294,000,000","294,000,000",,,,0,0,华东,浙江,杭州市,S 综合,www.soyea.com.cn
000910,大亚科技,大亚科技股份有限公司,"DARE TECHNOLOGY CO.,LTD",江苏省丹阳经济技术开发区金陵西路95号,000910,大亚科技,1999-06-30,"527,500,000","527,500,000",,,,0,0,华东,江苏,镇江市,C 制造业,www.dareglobal.com.cn
000911,南宁糖业,南宁糖业股份有限公司,"NANNING SUGAR INDUSTRY CO.,LTD",广西壮族自治区南宁市青秀区古城路10号,000911,南宁糖业,1999-05-27,"324,080,937","324,080,937",,,,0,0,华南,广西,南宁市,C 制造业,www.nnsugar.com
000912,泸天化,四川泸天化股份有限公司,"SICHUAN LUTIANHUA CO.,LTD",四川省成都市,000912,泸天化,1999-06-03,"585,000,000","585,000,000",,,,0,0,西南,四川,成都市,C 制造业,www.sclth.com
000913,*ST钱江,浙江钱江摩托股份有限公司,"ZHEJIANG QIANJIQNG MOTORYCLE CO.,LTD",浙江省温岭市经济开发区,000913,*ST钱江,1999-05-14,"453,536,000","453,436,347",,,,0,0,华东,浙江,台州市,C 制造业,www.qjmotor.com
000915,山大华特,山东山大华特科技股份有限公司,"SHANDONG SHANDA WIT SCIENCE AND TECHNOLOGY CO., LTD",山东省沂南县县城振兴路6号,000915,山大华特,1999-06-09,"180,254,989","179,376,429",,,,0,0,华东,山东,临沂市,C 制造业,www.sd-wit.com
000916,华北高速,华北高速公路股份有限公司,"HUABEI EXPRESSWAY CO.,LTD",北京市经济技术开发区东环北路9号,000916,华北高速,1999-09-27,"1,090,000,000","1,089,979,262",,,,0,0,华北,北京,北京市,G 运输仓储,www.hbgsgl.com.cn
000917,电广传媒,湖南电广传媒股份有限公司,"HUNAN TV&BROADCAST INTERMEDIARY CO., LTD",湖南省长沙市浏阳河大桥东湖南金鹰影视文化城,000917,电广传媒,1999-03-25,"1,417,556,338","1,062,094,413",,,,0,0,华中,湖南,长沙市,I 信息技术,www.tik.com.cn
000918,嘉凯城,嘉凯城集团股份有限公司,"China Calxon Group Co., Ltd.",浙江省杭州市惠民路56号1号楼318室,000918,嘉凯城,1999-07-20,"1,804,191,500","1,804,191,500",,,,0,0,华东,浙江,杭州市,K 房地产,www.calxon-group.com
000919,金陵药业,金陵药业股份有限公司,"JINLING PHARMACEUTICAL CO.,LTD",江苏省南京市南京经济技术开发区新港大道58号,000919,金陵药业,1999-11-18,"504,000,000","503,152,876",,,,0,0,华东,江苏,南京市,C 制造业,www.jlyy000919.com
000920,南方汇通,南方汇通股份有限公司,"SOUTH HUITON CO.,LTD",贵州省贵阳国家高新技术产业开发区,000920,南方汇通,1999-06-16,"422,000,000","421,892,825",,,,0,0,西南,贵州,贵阳市,C 制造业,www.csrgc.com.cn/ht
000921,海信科龙,海信科龙电器股份有限公司,HISENSE KELON ELECTRICAL HOLDINGS COMPANY LIMITED,广东省佛山市顺德区容桂街道容港路8号,000921,海信科龙,1999-07-13,"903,135,562","902,023,927",,,,0,0,华南,广东,佛山市,C 制造业,www.kelon.com
000922,佳电股份,哈尔滨电气集团佳木斯电机股份有限公司,"Harbin Electric Coporation Jiamusi Electric Machine CO.,Ltd",黑龙江省佳木斯市长安东路247号,000922,佳电股份,1999-06-18,"543,667,277","457,900,496",,,,0,0,东北,黑龙江,佳木斯市,C 制造业,www.jemlc.com
000923,河北宣工,河北宣化工程机械股份有限公司,"XUANHUA CONSTRUCTION MACHINERY CO.,LTD",河北省张家口市宣化区东升路21号,000923,河北宣工,1999-07-14,"198,000,000","198,000,000",,,,0,0,华北,河北,张家口市,C 制造业,www.hbxg.com
000925,众合科技,浙江众合科技股份有限公司,"United Science & Technology Co., Ltd.",浙江省杭州市滨江区江汉路1785号双城国际4号楼17层,000925,众合科技,1999-06-11,"320,323,862","305,513,611",,,,0,0,华东,浙江,杭州市,C 制造业,www.unitedmne.com
000926,福星股份,湖北福星科技股份有限公司,"HUBEI FUXING SCIENCE AND TECHNOLOGY CO.,LTD",湖北省汉川市沉湖镇福星街1号,000926,福星股份,1999-06-18,"949,322,474","530,523,718",,,,0,0,华中,湖北,孝感市,K 房地产,www.chinafxkj.com
000927,一汽夏利,天津一汽夏利汽车股份有限公司,"TIANJIN FAW XIALI AUTOMOBILE CO.,LTD",天津市西青区京福公路578号,000927,一汽夏利,1999-07-27,"1,595,174,020","1,595,170,960",,,,0,0,华北,天津,天津市,C 制造业,www.tjfaw.com.cn
000928,中钢国际,中钢国际工程技术股份有限公司,"Sinosteel Engineering & Technology Co., Ltd.",吉林省吉林市昌邑区江湾路2号10楼1002、1003,000928,中钢国际,1999-03-12,"642,562,099","412,865,702",,,,0,0,东北,吉林,吉林市,E 建筑业,mecc.sinosteel.com
000929,兰州黄河,兰州黄河企业股份有限公司,"LANZHOU HUANGHE ENTERPRISE CO., LTD.",甘肃省兰州市七里河区郑家庄108号,000929,兰州黄河,1999-06-23,"185,766,000","185,632,527",,,,0,0,西北,甘肃,兰州市,C 制造业,www.yellowriver.net.cn
000930,中粮生化,中粮生物化学（安徽）股份有限公司,"COFCO BIOCHEMICAL (ANHUI) CO.,LTD",安徽省蚌埠市中粮大道1号,000930,中粮生化,1999-07-12,"964,411,115","964,396,472",,,,0,0,华东,安徽,蚌埠市,C 制造业,www.zlahsh.com
000931,中 关 村,北京中关村科技发展(控股)股份有限公司,"BEIJING CENTERGATE TECHNOLOGIES (HOLDING) CO., LTD",北京市海淀区中关村南大街32号,000931,中 关 村,1999-07-12,"674,846,940","667,948,817",,,,0,0,华北,北京,北京市,S 综合,www.centek.com.cn
000932,华菱钢铁,湖南华菱钢铁股份有限公司,"HUNAN VALIN STEEL CO.,LTD",湖南省长沙市天心区湘府西路222号华菱园主楼,000932,华菱钢铁,1999-08-03,"3,015,650,025","3,015,065,806",,,,0,0,华中,湖南,长沙市,C 制造业,www.valin.cn
000933,*ST神火,河南神火煤电股份有限公司,"HENAN SHEN HUO COAL & POWER CO.,LTD",河南省永城市东城区光明路17号,000933,*ST神火,1999-08-31,"1,900,500,000","1,900,448,400",,,,0,0,华中,河南,商丘市,C 制造业,www.shenhuo.com
000935,四川双马,四川双马水泥股份有限公司,SICHUAN SHUANGMA CEMENT CO.LTD,四川省江油市二朗庙镇,000935,四川双马,1999-08-24,"763,440,333","319,410,000",,,,0,0,西南,四川,绵阳市,C 制造业,www.cement.com.cn
000936,华西股份,江苏华西村股份有限公司,"JIANGSU HUAXICUN CO., LTD.",江苏省江阴市华西村,000936,华西股份,1999-08-10,"886,012,887","747,835,889",,,,0,0,华东,江苏,无锡市,C 制造业,www.jshuaxicun.com、www.v-capital.cn
000937,冀中能源,冀中能源股份有限公司,"Jizhong  Energy  Resources  Co., Ltd.",河北省邢台市中兴西大街191号,000937,冀中能源,1999-09-09,"3,533,546,850","2,906,599,842",,,,0,0,华北,河北,邢台市,B 采矿业,www.jznygf.com
000938,紫光股份,紫光股份有限公司,"UNISPLENDOUR CO.,LTD",北京市清华大学紫光大楼,000938,紫光股份,1999-11-04,"1,042,303,162","206,074,263",,,,0,0,华北,北京,北京市,C 制造业,www.unis.cn
000939,凯迪生态,凯迪生态环境科技股份有限公司,"KAIDI ECOLOGICAL AND ENVIRONMENTAL TECHNOLOGY CO.,LTD",湖北省武汉市东湖开发区江夏大道特1号凯迪大厦,000939,凯迪生态,1999-09-23,"1,507,292,372","941,176,044",,,,0,0,华中,湖北,武汉市,D 水电煤气,www.china-kaidi.com
000948,南天信息,云南南天电子信息产业股份有限公司,"YUNNAN NANTIAN ELECTRONICS INFORMATION CO.,LTD",云南省昆明市高新技术产业开发区高新区产业研发基地,000948,南天信息,1999-10-14,"246,606,046","231,389,723",,,,0,0,西南,云南,昆明市,I 信息技术,www.nantian.com.cn
000949,新乡化纤,新乡化纤股份有限公司,"XINXIANG CHEMICAL FIBER CO., LTD",河南省新乡市凤泉区锦园路,000949,新乡化纤,1999-10-21,"1,027,241,303","1,026,701,934",,,,0,0,华中,河南,新乡市,C 制造业,www.bailu.com
000950,*ST建峰,重庆建峰化工股份有限公司,"CHONGQING JIANFENG CHEMICAL CO.,LTD",重庆市涪陵区白涛街道,000950,*ST建峰,1999-09-16,"598,799,235","598,791,735",,,,0,0,西南,重庆,重庆市,C 制造业,www.jfhggf.com
000951,中国重汽,中国重汽集团济南卡车股份有限公司,"CNHTC JINAN TRUCK CO., LTD.",山东省济南市市中区党家庄镇南首,000951,中国重汽,1999-11-25,"671,080,800","670,902,360",,,,0,0,华东,山东,济南市,C 制造业,www.jntruck.com
000952,广济药业,湖北广济药业股份有限公司,"HUBEI GUANGJI PHARMACEUTICAL CO., LTD",湖北省武穴市江堤路1号,000952,广济药业,1999-11-12,"251,705,513","251,679,806",,,,0,0,华中,湖北,黄冈市,C 制造业,www.guangjipharm.com
000953,河池化工,广西河池化工股份有限公司,"GUANGXI HECHI CHEMICAL CO.,LTD",广西壮族自治区河池市六甲镇,000953,河池化工,1999-12-02,"294,059,437","294,046,276",,,,0,0,华南,广西,河池市,C 制造业,www.hechihuagong.com.cn
000955,欣龙控股,欣龙控股（集团）股份有限公司,XINLONG HOLDING （GROUP）COMPANY LTD,海南省澄迈县老城工业开发区,000955,欣龙控股,1999-12-09,"538,395,000","538,395,000",,,,0,0,华南,海南,澄迈县,C 制造业,www.xinlong-holding.com
000957,中通客车,中通客车控股股份有限公司,"ZHONGTONG BUS & HOLDING CO.,LTD",山东省聊城市经济开发区黄河路261号,000957,中通客车,2000-01-13,"296,451,968","238,489,330",,,,0,0,华东,山东,聊城市,C 制造业,www.zhongtong.com
000958,东方能源,石家庄东方能源股份有限公司,"SHIJIAZHUANG DONGFANG ENERGY CO.,LTD",河北省石家庄市建华南大街161号,000958,东方能源,1999-12-23,"551,136,613","250,474,588",,,,0,0,华北,河北,石家庄市,D 水电煤气,www.dfrdjt.com
000959,首钢股份,北京首钢股份有限公司,"BEIJING SHOUGANG CO.,LTD",北京市石景山区石景山路,000959,首钢股份,1999-12-16,"5,289,389,600","1,206,145,283",,,,0,0,华北,北京,北京市,C 制造业,www.sggf.com.cn
000960,锡业股份,云南锡业股份有限公司,"Yunnan Tin Co., Ltd.",云南省昆明高新技术产业开发区,000960,锡业股份,2000-02-21,"1,472,055,068","1,151,216,991",,,,0,0,西南,云南,昆明市,C 制造业,www.ytl.com.cn
000961,中南建设,江苏中南建设集团股份有限公司,"Jiangsu Zhongnan Construction Group CO.,LTD",江苏省海门市常乐镇,000961,中南建设,2000-03-01,"3,709,788,797","2,909,662,518",,,,0,0,华东,江苏,南通市,E 建筑业,www.zhongnanconstruction.cn
000962,*ST东钽,宁夏东方钽业股份有限公司,"NINGXIA ORIENT TANTALUM INDUSTRY CO.,LTD",宁夏回族自治区石嘴山市大武口区冶金路,000962,*ST东钽,2000-01-20,"440,832,644","440,831,060",,,,0,0,西北,宁夏,石嘴山市,C 制造业,www.otic.com.cn
000963,华东医药,华东医药股份有限公司,"HUADONG MEDICINE CO.,LTD",浙江省杭州市延安路468号1号楼1号门9、10楼,000963,华东医药,2000-01-27,"486,058,208","434,059,991",,,,0,0,华东,浙江,杭州市,F 批发零售,www.eastchinapharm.com
000965,天保基建,天津天保基建股份有限公司,Tianjin Tianbao Infrastructure Co..Ltd,天津市天津空港经济区西五道35号汇津广场一号楼,000965,天保基建,2000-04-06,"1,008,937,178","1,008,937,178",,,,0,0,华北,天津,天津市,K 房地产,www.tbjijian.com
000966,长源电力,国电长源电力股份有限公司,"GUODIAN CHANGYUAN ELECTRIC POWER CO.,LTD",湖北省武汉市洪山区徐东大街113号国电大厦,000966,长源电力,2000-03-16,"1,108,284,080","1,108,284,080",,,,0,0,华中,湖北,武汉市,D 水电煤气,www.cydl.com.cn
000967,盈峰环境,盈峰环境科技集团股份有限公司,Infore Environment Technology Group Co. Ltd.,浙江省绍兴市上虞区人民西路1818号,000967,盈峰环境,2000-03-30,"727,386,604","410,158,146",,,,0,0,华东,浙江,绍兴市,C 制造业,www.inforeenviro.com
000968,*ST煤气,太原煤气化股份有限公司,"Taiyuan　Coal　Gasification　Company,　Limited",山西省太原市和平南路83号,000968,*ST煤气,2000-06-22,"513,747,000","513,747,000",,,,0,0,华北,山西,太原市,B 采矿业,www.tymqh.com
000969,安泰科技,安泰科技股份有限公司,"ADVANCED TECHNOLOGY & MATERIALS CO.,LTD",北京市海淀区学院南路76号,000969,安泰科技,2000-05-29,"1,026,008,097","861,424,832",,,,0,0,华北,北京,北京市,C 制造业,www.atmcn.com
000970,中科三环,北京中科三环高技术股份有限公司,"BEIJING ZHONG KE SAN HUAN HIGH-TECH CO., LTD",北京市海淀区中关村东路66号甲1号楼27层,000970,中科三环,2000-04-20,"1,065,200,000","1,063,501,194",,,,0,0,华北,北京,北京市,C 制造业,www.san-huan.com.cn
000971,高升控股,高升控股股份有限公司,"GOSUN HOLDING CO., LTD.",湖北省仙桃市勉阳大道131号,000971,高升控股,2000-04-27,"430,945,383","242,560,786",,,,0,0,华中,湖北,仙桃市,I 信息技术,www.gosun.com
000972,中基健康,中基健康产业股份有限公司,"CHALKIS HEALTH INDUSTRY CO.,LTD",新疆维吾尔自治区乌鲁木齐市青年路北一巷8号,000972,中基健康,2000-09-26,"771,283,579","771,176,704",,,,0,0,西北,新疆,乌鲁木齐市,C 制造业,www.chalkistomato.com
000973,佛塑科技,佛山佛塑科技集团股份有限公司,"FSPG HI-TECH CO., LTD",广东省佛山市禅城区汾江中路85号,000973,佛塑科技,2000-05-25,"967,423,171","772,478,682",,,,0,0,华南,广东,佛山市,C 制造业,www.fspg.com.cn
000975,银泰资源,银泰资源股份有限公司,"Yintai Resources Co.,Ltd.",内蒙古自治区锡林郭勒盟西乌珠穆沁旗巴拉嘎尔高勒镇哈拉图街,000975,银泰资源,2000-06-08,"1,081,616,070","878,560,419",,,,0,0,华北,内蒙古,锡林郭勒盟,B 采矿业,
000976,春晖股份,广东开平春晖股份有限公司,"GUANGDONG KAIPING CHUNHUI CO., LTD.",广东省开平市三埠区港口路10号19幢,000976,春晖股份,2000-06-01,"1,595,678,796","586,506,854",,,,0,0,华南,广东,江门市,C 制造业,www.my0976.com
000977,浪潮信息,浪潮电子信息产业股份有限公司,"LANGCHAO ELECTRONIC INFORMATION INDUSTRY CO.,LTD",山东省济南市浪潮路1036号,000977,浪潮信息,2000-06-08,"999,282,714","959,725,752",,,,0,0,华东,山东,济南市,C 制造业,www.inspur.com
000978,桂林旅游,桂林旅游股份有限公司,"GUILIN TOURISM CO.,LTD",广西壮族自治区桂林市翠竹路27-2号,000978,桂林旅游,2000-05-18,"360,100,000","360,034,375",,,,0,0,华南,广西,桂林市,N 公共环保,www.guilintravel.com
000979,中弘股份,中弘控股股份有限公司,"ZHONGHONG HOLDING CO.,LTD",安徽省宿州市浍水路271号,000979,中弘股份,2000-06-16,"5,993,286,571","4,607,942,649",,,,0,0,华东,安徽,宿州市,K 房地产,www.zhonghongholdings.com
000980,金马股份,黄山金马股份有限公司,"HUANGSHAN JINMA CO.,LTD",安徽省黄山市歙县经济技术开发区,000980,金马股份,2000-06-16,"528,140,000","527,660,750",,,,0,0,华东,安徽,黄山市,C 制造业,www.hsjinma.com
000981,银亿股份,银亿房地产股份有限公司,"YINYI REAL ESTATE CO,LTD",甘肃省兰州市城关区天水路318号兰州大学科技广场,000981,银亿股份,2000-06-22,"2,577,015,600","2,574,315,600",,,,0,0,西北,甘肃,兰州市,K 房地产,www.chinayinyi.cn
000982,中银绒业,宁夏中银绒业股份有限公司,"NINGXIA ZHONGYIN CASHMERE CO.,LTD",宁夏回族自治区灵武市羊绒工业园区中银大道南侧,000982,中银绒业,2000-07-06,"1,805,043,279","1,293,932,169",,,,0,0,西北,宁夏,银川市,C 制造业,www.zhongyincashmere.com
000983,西山煤电,山西西山煤电股份有限公司,"SHANXI XISHAN COAL AND ELECTRICITY POWER CO.,LTD",山西省太原市西矿街318号西山大厦,000983,西山煤电,2000-07-26,"3,151,200,000","3,151,197,660",,,,0,0,华北,山西,太原市,B 采矿业,www.xsmd.com.cn
000985,大庆华科,大庆华科股份有限公司,"DAQING HUAKE CO.,LTD",黑龙江省大庆高新技术产业开发区,000985,大庆华科,2000-07-26,"129,639,500","129,639,500",,,,0,0,东北,黑龙江,大庆市,C 制造业,www.huake.com
000987,广州友谊,广州友谊集团股份有限公司,"GUANGZHOU FRIENDSHIP CO., LTD",广东省广州市越秀区环市东路369号,000987,广州友谊,2000-07-18,"2,223,830,413","538,138,170",,,,0,0,华南,广东,广州市,F 批发零售,www.cgzfs.com
000988,华工科技,华工科技产业股份有限公司,"HUAGONG TECH CO.,LTD",湖北省武汉市东湖高新技术开发区华中科技大学科技园华工科技本部大楼,000988,华工科技,2000-06-08,"891,116,632","891,116,632",,,,0,0,华中,湖北,武汉市,C 制造业,www.hgtech.com.cn
000989,九 芝 堂,九芝堂股份有限公司,"JIUZHITANG CO.,LTD",湖南省长沙市桐梓坡西路339号,000989,九 芝 堂,2000-06-28,"869,354,236","246,221,058",,,,0,0,华中,湖南,长沙市,C 制造业,www.hnjzt.com
000990,诚志股份,诚志股份有限公司,"CHENGZHI Shareholding Co., Ltd.",江西省南昌市经济开发区玉屏东大道299号,000990,诚志股份,2000-07-06,"387,683,644","297,028,344",,,,0,0,华东,江西,南昌市,C 制造业,www.chengzhi.com.cn
000993,闽东电力,福建闽东电力股份有限公司,"FUJIAN MINDONG ELECTRIC POWER CO.,LTD",福建省宁德市环城路143号闽东大广场华隆大厦8-10层,000993,闽东电力,2000-07-31,"373,000,000","373,000,000",,,,0,0,华东,福建,宁德市,D 水电煤气,www.mdep.com.cn
000995,*ST皇台,甘肃皇台酒业股份有限公司,"GANSU HUANGTAI WINE―MARKETING INDUSTRY CO.,LTD",甘肃省武威市新建路55号,000995,*ST皇台,2000-08-07,"177,408,000","177,404,325",,,,0,0,西北,甘肃,武威市,C 制造业,www.huangtaichina.com
000996,中国中期,中国中期投资股份有限公司,"CHINA CIFCO INDUSTRY CO., LTD",北京市朝阳区麦子店西路3号12层1316,000996,中国中期,2000-07-18,"230,000,000","230,000,000",,,,0,0,华北,北京,北京市,F 批发零售,www.cifco996.com
000997,新 大 陆,福建新大陆电脑股份有限公司,"FUJIAN NEWLAND COMPUTER CO.,LTD",福建省福州市马尾区儒江西路1号,000997,新 大 陆,2000-08-07,"938,621,998","922,624,532",,,,0,0,华东,福建,福州市,I 信息技术,www.newlandcomputer.com
000998,隆平高科,袁隆平农业高科技股份有限公司,"YUAN LONGPING HIGH-TECH AGRICULTURE CO.,LTD",湖南省长沙市芙蓉区远大二路马坡岭农业高科技园内,000998,隆平高科,2000-12-11,"1,256,194,674","830,652,986",,,,0,0,华中,湖南,长沙市,A 农林牧渔,www.lpht.com.cn
000999,华润三九,华润三九医药股份有限公司,"China Resource Sanjiu Medical & Pharmaceutical CO., LTD",广东省深圳市龙华新区观澜高新园区观清路1号,000999,华润三九,2000-03-09,"978,900,000","977,742,318",,,,0,0,华南,广东,深圳市,C 制造业,www.999.com.cn
001696,宗申动力,重庆宗申动力机械股份有限公司,"CHENGDU ZONG SHEN THERMAL IMPETUS MACHINERY CO.,LTD",重庆市巴南区炒油场,001696,宗申动力,1997-03-06,"1,145,026,920","891,130,705",,,,0,0,西南,重庆,重庆市,C 制造业,www.zsengine.com
001896,豫能控股,河南豫能控股股份有限公司,"HENAN YUNENG HOLDINGS CO., LTD",河南省郑州市农业路东41号投资大厦B座8-12层,001896,豫能控股,1998-01-22,"855,275,976","661,921,546",,,,0,0,华中,河南,郑州市,D 水电煤气,www.yuneng.com.cn
001979,招商蛇口,招商局蛇口工业区控股股份有限公司,"CHINA MERCHANTS SHEKOU INDUSTRIAL ZONE HOLDINGS CO.,LTD",广东省深圳南山区蛇口兴华路6号南海意库3号楼,001979,招商蛇口,2015-12-30,"7,904,092,722","1,899,323,878",,,,0,0,华南,广东,深圳市,K 房地产,www.shekou.com
002001,新 和 成,浙江新和成股份有限公司,Zhejiang NHU Company Ltd.,浙江省新昌县羽林街道江北路4号,002001,新 和 成,2004-06-25,"1,088,919,000","1,073,088,902",,,,0,0,华东,浙江,绍兴市,C 制造业,www.cnhu.com
002002,鸿达兴业,鸿达兴业股份有限公司,"Hongda Xingye Co.,Ltd.",江苏省扬州市广陵区杭集镇曙光路,002002,鸿达兴业,2004-06-25,"958,860,282","523,424,510",,,,0,0,华东,江苏,扬州市,C 制造业,www.002002.cn
002003,伟星股份,浙江伟星实业发展股份有限公司,"Zhejiang Weixing Industrial Development Co., Ltd.",浙江省临海市花园工业区,002003,伟星股份,2004-06-25,"430,640,798","354,278,115",,,,0,0,华东,浙江,台州市,C 制造业,www.weixing.cn
002004,华邦健康,华邦生命健康股份有限公司,"HUAPONT LIFE SCIENCES CO., LTD.",重庆市渝北区人和星光大道69号,002004,华邦健康,2004-06-25,"2,034,877,685","1,326,172,188",,,,0,0,西南,重庆,重庆市,C 制造业,www.huapont.com.cn
002005,德豪润达,广东德豪润达电气股份有限公司,"Elec-Tech International Co., Ltd.",广东省珠海市香洲区唐家湾镇金凤路1号,002005,德豪润达,2004-06-25,"1,396,400,000","1,166,400,000",,,,0,0,华南,广东,珠海市,C 制造业,www.electech.com.cn
002006,精功科技,浙江精功科技股份有限公司,ZHEJIANG  JINGGONG  SCIENCE & TECHNOLOGY  Co.，LTD,浙江省绍兴市柯桥区鉴湖路1809号,002006,精功科技,2004-06-25,"455,160,000","442,905,915",,,,0,0,华东,浙江,绍兴市,C 制造业,www.jgtec.com.cn
002007,华兰生物,华兰生物工程股份有限公司,Hualan Biological Engineering Inc.,河南省新乡市华兰大道甲1号,002007,华兰生物,2004-06-25,"930,087,680","802,034,731",,,,0,0,华中,河南,新乡市,C 制造业,www.hualanbio.com
002008,大族激光,大族激光科技产业集团股份有限公司,"Han’s Laser Technology Industry Group Co., Ltd.",广东省深圳市南山区深南大道9988号,002008,大族激光,2004-06-25,"1,066,411,614","990,314,330",,,,0,0,华南,广东,深圳市,C 制造业,www.hanslaser.com
